query_id,retrieved_docs
011,cts_foc_0002188 cdn_foc_0006869 cte_foc_0001449 cdn_foc_0006870 cdn_foc_0006865 cdn_foc_0006866 cdn_foc_0002189 cdn_soc_0002239 cte_foc_0001454 cts_soc_0004301 cts_soc_0005346 cts_foc_0002187 cts_esy_0000206 cts_foc_0002185 cts_soc_0004302 cts_foc_0002186 cdn_foc_0006868 cts_soc_0002407 cdn_foc_0006872 cdn_soc_0002235 cdn_foc_0006867 cts_soc_0005432 cdn_soc_0002234 cte_foc_0001482 cts_soc_0002655 cts_foc_0002181 cts_soc_0001509 cts_foc_0002183 cte_foc_0002845 cts_soc_0003452 cts_soc_0002667 cts_soc_0001424 cts_for_0000839 cts_soc_0001344 cts_for_0000848 cts_foc_0001318 cts_soc_0003418 cts_soc_0003453 cdn_chi_0000733 cts_soc_0003399 cte_foc_0002731 cts_foc_0004309 cte_foc_0002738 cts_soc_0002814 cte_foc_0001505 cts_soc_0000214 cts_ent_0000866 cdn_foc_0007629 cte_foc_0002164 cts_for_0000837 cts_soc_0000216 cts_pol_0001010 cdn_foc_0007633 cts_soc_0001169 cte_esy_0000105 cts_soc_0005778 cts_soc_0003192 cdn_foc_0002992 cts_soc_0000601 cts_chi_0001815 cts_foc_0003151 cts_soc_0000496 cdn_soc_0002963 cts_pol_0002876 cts_soc_0000085 cdn_foc_0000859 cts_soc_0001522 cts_soc_0001197 cts_chi_0000727 cts_soc_0004077 cdn_chi_0000795 cts_soc_0003451 cts_soc_0002553 cdn_soc_0002422 cts_soc_0001209 cts_foc_0005152 cts_soc_0004152 cts_soc_0004886 cts_foc_0003520 cts_soc_0005269 cts_soc_0003128 cts_ent_0000805 cts_soc_0002115 cts_soc_0003018 cts_soc_0002690 cts_soc_0004345 cts_soc_0005855 cts_soc_0005323 cts_chi_0001654 cts_foc_0003150 ctc_chi_0000514 cts_soc_0002150 cts_soc_0005716 cts_chi_0000737 cts_chi_0000743 cte_foc_0001053 cdn_soc_0002659 cts_soc_0004909 cts_foc_0000230 cts_foc_0004923
012,cdn_edu_0000876 cts_soc_0004984 cts_soc_0004991 cdn_soc_0004841 cts_soc_0005788 cdn_edu_0000946 cts_soc_0005420 cte_foc_0003562 cts_for_0001997 cdn_soc_0004840 cts_for_0001970 cts_soc_0004715 cts_soc_0005787 cts_for_0001677 cts_soc_0006228 cts_soc_0004752 cts_for_0001697 cts_soc_0005786 cts_soc_0004753 cdn_soc_0004849 cts_for_0001676 cdn_soc_0004071 cdn_edu_0001382 cts_for_0001971 cts_for_0001689 cts_for_0001973 cts_for_0001993 cts_soc_0004959 cts_for_0001675 cts_for_0001979 cts_for_0001980 cts_soc_0005401 cdn_loc_0001326 ctc_tec_0000433 cdn_spo_0000859 cdn_edu_0000742 cts_ent_0003367 ctc_ser_0000756 ctc_tec_0000194 cts_art_0000326 cts_art_0000497 cts_art_0000258 cts_soc_0005402 cts_eco_0000611 cts_esy_0000470 cts_ent_0000167 ctc_ser_0000296 ctc_ser_0000301 cdn_soc_0001946 cts_soc_0000448 cdn_soc_0000005 ctc_ser_0001133 cdn_edu_0001197 cdn_foc_0005429 cdn_foc_0006142 cdn_edu_0000835 cdn_soc_0004880 cte_foc_0001178 cdn_eco_0003462 cts_soc_0005865 cdn_soc_0004687 cts_chi_0000278 cts_soc_0004035 cts_eco_0001102 cts_eco_0001090 cts_soc_0005866 cts_soc_0004942 cts_soc_0000042 cdn_edu_0000479 cts_art_0001656 cdn_edu_0000817 ctc_tec_0002177 ctc_tec_0000161 ctc_tec_0000429 cdn_soc_0000147 cts_soc_0005286 cte_esy_0000069 ctc_ser_0001111 ctc_foc_0001545 ctc_dep_0001182 cdn_edu_0000355 cte_foc_0000501 cdn_edu_0000577 ctc_ser_0000665 cts_chi_0000041 cts_eco_0004386 cdn_loc_0000543 cdn_eco_0001487 cte_foc_0000966 cts_pol_0003005 cdn_edu_0001310 cdn_soc_0000824 ctc_mnf_0001983 cts_art_0000760 cdn_soc_0004069 cdn_edu_0000552 cdn_chi_0002267 cts_chi_0002284 cdn_edu_0001269 cdn_foc_0004098
013,cdn_foc_0006898 cdn_spo_0001594 cdn_spo_0000085 cdn_spo_0000087 cdn_spo_0000100 cdn_soc_0002584 cdn_foc_0006895 cts_soc_0000949 cdn_spo_0000043 cdn_spo_0001597 cdn_soc_0005122 cdn_spo_0000088 cts_soc_0003142 cts_esy_0000232 cts_soc_0003653 cdn_spo_0000205 cdn_spo_0000078 cdn_foc_0006894 cts_for_0000996 cts_soc_0002633 cts_foc_0002215 cts_soc_0003499 cts_soc_0006085 cdn_spo_0001220 cts_soc_0006088 cte_foc_0003538 cdn_soc_0002583 cts_for_0001878 cts_for_0001202 cdn_soc_0002582 cdn_soc_0005118 cdn_foc_0006896 cdn_spo_0000770 cdn_spo_0000099 cdn_soc_0002585 cts_for_0001876 cdn_spo_0001552 cts_for_0000945 cts_esy_0000211 cdn_spo_0001605 cdn_spo_0000481 cts_for_0001877 cdn_spo_0001550 cdn_spo_0001274 cts_for_0001567 cdn_spo_0001563 cte_foc_0003726 cdn_spo_0000956 cts_soc_0005737 cdn_soc_0001022 cdn_spo_0001081 cdn_spo_0001236 cdn_spo_0000473 cdn_spo_0001434 cte_foc_0002059 cdn_spo_0000041 cdn_spo_0000211 cdn_spo_0000486 cdn_spo_0001288 cdn_spo_0001257 cdn_spo_0000314 cdn_foc_0008655 cdn_spo_0001128 cdn_spo_0001030 cdn_spo_0001357 cdn_spo_0000003 cdn_spo_0000375 cdn_spo_0000828 cdn_spo_0000177 cdn_spo_0000464 cts_soc_0003070 cts_soc_0004090 cts_foc_0005562 cdn_spo_0000412 cts_soc_0006262 cdn_spo_0000901 cdn_spo_0000570 cts_pol_0002134 cdn_spo_0001545 cdn_spo_0000260 cdn_spo_0001354 cdn_foc_0008656 cdn_soc_0002224 cdn_spo_0000086 cdn_spo_0000854 cdn_spo_0000098 cdn_soc_0004622 cdn_eco_0001224 cts_soc_0003953 cdn_spo_0001321 cdn_spo_0001133 cdn_spo_0000080 cdn_spo_0001161 cdn_spo_0000748 cdn_spo_0001377 cdn_spo_0001300 cdn_spo_0000926 cts_for_0001859 cdn_spo_0001272 cdn_spo_0001463
014,cts_soc_0000198 cte_foc_0003581 cts_soc_0005701 cts_soc_0005744 cts_soc_0004771 cts_for_0000538 cts_soc_0000166 cdn_soc_0001663 cdn_for_0000192 cdn_soc_0001662 cts_esy_0000489 cts_soc_0001862 cts_soc_0000334 cts_soc_0000250 cts_soc_0004772 cts_for_0002005 cdn_soc_0004731 cts_for_0000603 cdn_soc_0000620 cts_soc_0000094 cdn_soc_0000206 cts_soc_0006220 cdn_soc_0003578 cts_soc_0003749 cte_foc_0003568 cdn_soc_0001664 cdn_soc_0005054 cdn_soc_0003735 cts_soc_0005751 cdn_soc_0002603 cte_foc_0000999 cts_soc_0000070 cts_soc_0005861 cdn_soc_0004711 cdn_soc_0002654 cdn_soc_0000643 cdn_soc_0001373 cdn_soc_0000348 cts_soc_0002062 cdn_soc_0001398 cts_soc_0000312 cte_foc_0003612 cdn_foc_0008454 cts_foc_0005174 cdn_soc_0004873 cdn_soc_0004793 cdn_ent_0000023 cdn_eco_0000199 cts_soc_0004451 cte_foc_0000864 cte_esy_0000232 cdn_soc_0000374 cdn_foc_0002019 cdn_soc_0002801 cdn_soc_0003666 cts_soc_0001864 cdn_for_0000084 cts_soc_0005946 cdn_soc_0001660 cdn_edu_0000524 cdn_soc_0003686 cte_foc_0003337 cdn_soc_0003962 cdn_soc_0000094 cdn_foc_0004013 cts_for_0000718 cts_soc_0001201 cdn_ent_0000092 cdn_edu_0000684 cdn_edu_0000660 cts_soc_0005276 cts_soc_0000117 cts_eco_0004072 cts_soc_0005904 cdn_soc_0003679 cte_foc_0000934 cts_soc_0005284 cdn_soc_0000063 cte_foc_0003524 cts_soc_0002588 cts_soc_0000101 cdn_for_0000590 cdn_soc_0002003 cts_ent_0002480 cdn_soc_0000713 cdn_edu_0000237 cts_soc_0005743 cts_soc_0004319 ctc_chi_0000066 cts_soc_0005808 cts_foc_0000830 cdn_foc_0008620 cdn_soc_0000616 cts_soc_0005943 cdn_foc_0005368 cts_soc_0000383 cts_soc_0003670 cts_foc_0001321 cdn_edu_0000944 cdn_soc_0003644
015,cts_pol_0002104 cts_pol_0002130 cts_ent_0002422 cdn_foc_0007442 cts_pol_0001986 cdn_foc_0007502 cts_foc_0003431 cdn_foc_0007489 ctc_foc_0002290 cts_foc_0003364 cdn_foc_0007463 cts_ent_0002431 cts_pol_0002068 ctc_dep_0000267 cts_pol_0000532 cdn_foc_0003657 cts_ent_0000556 cts_for_0001304 cdn_foc_0001868 cdn_ent_0000749 cts_pol_0002341 cdn_ent_0000709 cts_pol_0002198 cts_foc_0004218 ctc_chi_0001869 cts_foc_0002453 cts_foc_0003333 cts_foc_0002461 cts_ent_0001514 cts_ent_0001196 cdn_foc_0003581 cdn_soc_0003320 cts_pol_0001867 cts_chi_0002706 cdn_foc_0003178 cdn_foc_0007458 cdn_foc_0004273 cts_ent_0000496 cdn_foc_0003459 cts_ent_0002614 cdn_chi_0001408 cts_foc_0003484 cdn_foc_0007464 cdn_foc_0003922 cts_ent_0003136 cdn_ent_0000679 cts_foc_0003520 ctc_foc_0001454 cts_soc_0002910 cdn_foc_0007663 cdn_foc_0007672 cts_foc_0003482 cts_pol_0001726 cts_int_0001305 cdn_foc_0007515 cts_ent_0000054 ctc_esy_0000028 cts_pol_0001827 ctc_foc_0003139 cts_foc_0003930 cts_for_0001625 cts_int_0001266 cts_ent_0003154 cdn_foc_0007017 cts_pol_0000223 cts_ent_0003240 cts_for_0001348 ctc_mnf_0001840 cdn_foc_0007145 cts_ent_0002068 cdn_for_0000438 cts_ent_0002840 cdn_ent_0001385 cts_soc_0003289 cdn_foc_0001863 cts_pol_0002133 cte_foc_0002759 cts_ent_0002505 cts_for_0002124 cts_for_0001303 cts_foc_0003543 cdn_foc_0003476 cts_esy_0000194 cts_ent_0000011 cts_pol_0001972 cdn_ent_0000688 cts_pol_0002107 cdn_soc_0001221 cts_ent_0000520 ctc_tec_0000369 cts_esy_0000321 cts_ent_0001437 cdn_foc_0007565 cts_for_0000023 cts_soc_0004572 cdn_foc_0007558 cts_pol_0001806 cts_int_0001245 cdn_soc_0002931 cts_pol_0002924
016,cts_soc_0001667 cdn_soc_0001975 cte_foc_0000351 cts_soc_0002130 cts_soc_0000402 cdn_soc_0000799 cts_soc_0001669 cdn_soc_0001864 cts_soc_0001352 cdn_soc_0003505 cte_foc_0000676 cts_esy_0000115 cte_foc_0001389 cts_foc_0003042 cte_foc_0000590 cts_soc_0000900 cts_soc_0002995 cts_soc_0001272 cts_soc_0000661 cte_foc_0000271 cdn_foc_0006186 cts_soc_0001849 cts_soc_0004800 cdn_soc_0001679 cts_chi_0000830 cte_foc_0000657 cdn_soc_0000580 cts_soc_0001666 cts_for_0000292 cts_soc_0000110 cdn_soc_0002795 cdn_soc_0004868 cts_soc_0002272 cts_soc_0001622 cdn_foc_0006091 cts_soc_0001350 cts_soc_0001090 cdn_soc_0002016 cts_soc_0002659 cts_soc_0003025 cts_soc_0003051 cts_soc_0000772 cdn_chi_0000741 cts_soc_0001564 cts_for_0000482 cdn_soc_0000648 cdn_soc_0002600 cte_foc_0001778 cdn_chi_0000698 cts_soc_0000796 cdn_soc_0001129 cts_soc_0004400 cts_soc_0003981 cdn_soc_0001614 cte_foc_0000671 cdn_chi_0000813 cts_soc_0001270 cdn_foc_0006264 cts_soc_0002377 cts_soc_0001723 cts_soc_0000851 cts_soc_0001063 cts_soc_0000871 cts_soc_0004398 cts_soc_0000889 cdn_soc_0004702 cts_soc_0004049 cts_soc_0003113 cts_soc_0003123 cts_chi_0000942 cts_soc_0003162 cts_for_0000343 cts_soc_0002932 cdn_soc_0000207 cdn_soc_0002484 cts_for_0002018 cts_foc_0000544 cdn_soc_0002599 cdn_soc_0000941 cdn_soc_0000870 cts_soc_0002131 cdn_soc_0000384 cdn_foc_0006122 cdn_soc_0000556 cte_foc_0000211 cts_soc_0004399 cts_soc_0000669 cts_soc_0000672 cdn_foc_0006259 cte_foc_0003757 cts_soc_0001112 cts_soc_0000751 cdn_chi_0000680 cts_soc_0001133 cts_soc_0001132 cdn_soc_0002264 cts_chi_0000933 cts_for_0000461 cts_foc_0000561 cte_esy_0000020
017,cts_pol_0000173 cts_pol_0002264 cdn_foc_0000324 cts_pol_0000152 cdn_foc_0000172 cte_foc_0000094 cts_foc_0003787 cts_pol_0000157 cts_pol_0000883 cts_for_0000083 cts_pol_0000078 cts_for_0000111 cts_foc_0004742 cts_for_0001597 cts_pol_0000092 cts_soc_0001693 cts_esy_0000022 cts_for_0001812 cts_pol_0002263 cdn_foc_0000441 cts_pol_0000007 cts_pol_0000181 cdn_soc_0003519 cts_pol_0000180 cts_soc_0005115 cdn_foc_0000326 cts_for_0001165 cdn_foc_0004098 cdn_foc_0002543 cdn_foc_0002563 cts_pol_0000179 cte_foc_0000174 cdn_soc_0002849 cts_pol_0001470 cts_soc_0001575 cdn_foc_0000303 cts_soc_0003021 cdn_foc_0002753 cts_soc_0005172 cdn_soc_0003428 cts_soc_0003146 cts_pol_0000781 cts_pol_0001661 cdn_foc_0002889 cts_pol_0001643 cdn_foc_0002564 cdn_foc_0002544 cdn_foc_0005708 cts_soc_0003543 cdn_soc_0003953 cts_pol_0001602 cts_soc_0003044 cts_foc_0003702 cts_foc_0003082 cts_soc_0002972 cts_int_0000564 cts_int_0000566 cts_foc_0003081 cts_soc_0002974 cts_pol_0002574 cts_for_0000668 cdn_foc_0000312 cdn_soc_0002848 cts_pol_0001663 ctc_dep_0001564 cdn_foc_0004016 cdn_eco_0003079 cdn_soc_0000777 cts_foc_0001188 cts_for_0002047 cts_soc_0002611 cts_pol_0000672 cte_foc_0001185 cts_chi_0002307 cdn_foc_0002845 cts_foc_0003677 cts_soc_0001023 cts_soc_0000163 cdn_soc_0001652 cdn_foc_0006731 cdn_foc_0001818 cts_soc_0003172 cts_soc_0003155 cts_int_0000377 cte_foc_0002547 cts_esy_0000165 cdn_eco_0003779 ctc_foc_0001481 cdn_foc_0007913 cdn_foc_0004160 cts_foc_0004221 cts_soc_0002612 cdn_soc_0001735 cts_for_0000655 cts_chi_0000530 ctc_foc_0001032 ctc_cgo_0000606 cts_soc_0001422 cdn_chi_0000603 cdn_foc_0000131
018,cdn_spo_0000352 cdn_spo_0000837 cdn_spo_0000243 cdn_spo_0000517 cdn_spo_0000941 cdn_spo_0000899 cdn_spo_0000373 cts_for_0001628 cdn_spo_0000961 cdn_soc_0001997 cdn_spo_0001000 cdn_spo_0000891 cts_for_0000991 cdn_soc_0002047 ctc_cgo_0000362 cdn_soc_0002126 cdn_soc_0003232 cdn_chi_0001725 ctc_chi_0001284 cdn_soc_0002100 ctc_eco_0000497 cte_foc_0003155 cts_soc_0004915 cdn_soc_0002391 cdn_soc_0002042 ctc_eco_0001345 cts_soc_0002243 cdn_spo_0001119 cdn_spo_0001400 cts_soc_0002406 cdn_soc_0004092 ctc_mnf_0000586 cte_foc_0003161 cdn_spo_0000963 ctc_foc_0001380 cts_ent_0001017 cdn_soc_0004311 cdn_soc_0002079 cts_soc_0004840 cdn_soc_0002142 ctc_dep_0001482 cts_eco_0002975 cdn_soc_0002076 cts_for_0001859 cte_foc_0002797 cdn_soc_0002561 cdn_spo_0001300 cdn_soc_0003217 cdn_soc_0001980 cts_soc_0002147 cdn_soc_0002127 ctc_mnf_0000756 ctc_cgo_0001074 ctc_esy_0000094 ctc_eco_0001140 ctc_chi_0000740 cts_soc_0004716 cdn_eco_0002891 ctc_mnf_0001661 cts_soc_0003826 cdn_soc_0001959 ctc_cgo_0000694 cts_soc_0000581 cdn_soc_0003705 cts_soc_0002255 cts_for_0001721 ctc_cgo_0000355 cdn_eco_0003486 cdn_soc_0001900 cdn_spo_0000979 cts_for_0000945 cdn_soc_0002099 cts_for_0001320 cdn_soc_0002211 cdn_soc_0003227 cts_for_0000743 cts_soc_0002438 cts_soc_0002396 cdn_soc_0002045 cdn_soc_0003877 cdn_spo_0000974 cdn_eco_0001387 cte_foc_0001319 ctc_mnf_0000950 cdn_soc_0004072 cdn_spo_0001297 cdn_soc_0002469 cdn_soc_0001902 cts_soc_0000382 cdn_soc_0002104 cts_soc_0002405 cts_soc_0002436 ctc_cgo_0000716 cts_soc_0002420 ctc_foc_0000963 cdn_foc_0003390 cdn_foc_0006780 cdn_soc_0004100 cdn_eco_0002337 ctc_cgo_0000265
019,cts_pol_0003207 cdn_foc_0004185 cts_pol_0003217 cdn_foc_0005643 cdn_foc_0005731 cts_pol_0002947 cts_pol_0003249 cdn_foc_0004196 cts_pol_0003216 cts_pol_0001392 cdn_foc_0001125 cdn_eco_0002017 cts_soc_0000002 cts_soc_0002716 cdn_foc_0006916 cts_pol_0002044 cts_pol_0002045 cts_esy_0000222 cdn_foc_0005444 cdn_soc_0003252 cdn_chi_0000503 cts_foc_0002980 cts_pol_0002023 cdn_foc_0002372 cts_pol_0002036 cts_foc_0002977 ctc_dep_0000536 cte_foc_0001624 cdn_foc_0001456 cdn_foc_0004620 cdn_foc_0000859 cdn_foc_0003452 cdn_eco_0001648 cts_for_0001162 cts_pol_0001134 cts_pol_0000768 cte_foc_0000081 cdn_foc_0002383 cts_esy_0000428 cte_esy_0000006 cdn_chi_0001039 cte_foc_0002399 cdn_foc_0004529 cts_soc_0004776 ctc_foc_0001803 cdn_for_0000170 cts_for_0001169 cdn_chi_0001806 cdn_foc_0006950 cdn_foc_0002956 cdn_for_0000238 cts_esy_0000012 cts_foc_0002975 cdn_foc_0003628 cts_for_0000033 cdn_foc_0001461 cdn_foc_0002230 cte_foc_0003527 cte_esy_0000142 cdn_foc_0002957 cdn_foc_0006845 cdn_foc_0000075 cdn_foc_0002173 cdn_for_0000467 cdn_for_0000329 cts_foc_0002338 cdn_soc_0003499 cdn_for_0000262 cts_for_0001646 cts_for_0000840 cts_soc_0002959 cts_pol_0001810 cdn_foc_0004237 cdn_foc_0003669 cts_foc_0002223 cdn_foc_0002207 cdn_chi_0001052 cdn_soc_0002313 cts_pol_0000215 cts_int_0002380 cts_int_0000120 cdn_foc_0005365 cts_foc_0004221 cts_soc_0000547 cdn_foc_0002524 cdn_foc_0002096 cdn_foc_0002964 cts_for_0001160 cts_foc_0005187 cts_pol_0003063 cts_soc_0005909 cte_foc_0001925 cts_foc_0000246 cts_foc_0002212 cts_foc_0002217 cte_foc_0001517 cdn_foc_0002362 cdn_chi_0000149 cts_for_0001308 cts_soc_0000605
020,cdn_foc_0008422 cts_int_0002719 cdn_foc_0008434 cts_int_0002759 cdn_foc_0008499 cdn_foc_0008510 cte_foc_0003560 cts_int_0002742 cts_int_0002718 cts_int_0002780 cts_foc_0005252 cts_int_0002722 cts_int_0002751 cts_int_0002723 cts_int_0002740 cts_int_0002663 cdn_foc_0008485 cts_int_0002687 cts_int_0002696 cdn_soc_0004738 cdn_foc_0008491 cts_int_0002675 cts_int_0000384 cts_int_0002677 cdn_foc_0005531 cdn_soc_0004973 cdn_foc_0005603 cdn_foc_0005806 cdn_foc_0005372 cdn_foc_0005532 cts_int_0002787 cdn_soc_0004735 cts_int_0002758 cdn_foc_0008498 cdn_foc_0005430 cts_int_0002748 cdn_foc_0008414 cdn_foc_0008601 cdn_foc_0008418 cts_int_0002939 cts_int_0002499 cts_pol_0003154 cts_int_0002781 cts_pol_0003195 cdn_foc_0005584 cts_int_0001453 cts_int_0002937 cts_int_0001459 cdn_foc_0008488 cts_int_0002697 cts_int_0002031 cts_int_0002761 cte_foc_0003463 cdn_foc_0005452 cts_int_0002741 cts_pol_0003230 cts_int_0002897 cts_for_0001996 cdn_foc_0005833 cts_int_0002651 cdn_foc_0005529 cts_int_0002845 cts_int_0002727 cts_int_0002665 ctc_eco_0001533 cts_int_0002749 ctc_eco_0001637 cts_int_0002707 cdn_foc_0004774 cts_int_0002403 cts_int_0002726 cts_int_0002835 cts_for_0002004 cdn_foc_0003039 cts_soc_0005593 cts_pol_0003221 cts_int_0002724 cts_for_0001990 cts_int_0002716 cts_int_0002881 cts_int_0002840 cdn_foc_0008631 cts_int_0001500 cts_int_0002743 cts_int_0002352 cts_int_0002688 cdn_soc_0004355 cts_int_0002833 cts_foc_0005512 cts_int_0002841 cts_int_0001631 cts_foc_0005706 ctc_eco_0001510 cts_int_0002938 cts_for_0001688 cdn_foc_0005275 cts_int_0000401 cdn_ent_0000178 cdn_foc_0005287 cts_int_0001482
021,cdn_soc_0002006 cts_for_0000709 ctc_ser_0000389 cts_eco_0001506 ctc_fin_0001382 ctc_ser_0000390 cte_foc_0001429 cts_ent_0000925 cts_ent_0000893 cte_foc_0003502 cte_esy_0000087 cts_esy_0000183 cts_eco_0003581 cts_soc_0002295 ctc_foc_0000976 cdn_loc_0001250 cts_ent_0001598 cts_eco_0001607 cts_ent_0001511 cts_esy_0000554 cts_for_0001073 ctc_ser_0001209 cdn_for_0000015 ctc_ser_0000772 cts_foc_0000188 cdn_edu_0000413 cdn_chi_0001641 cdn_chi_0000482 ctc_mnf_0002156 cts_art_0001366 cts_for_0001831 cts_chi_0002711 cdn_eco_0002085 cte_sto_0000742 cts_eco_0000846 ctc_mnf_0000296 cts_art_0001382 cts_art_0001405 ctc_ser_0000279 cdn_loc_0001803 ctc_ser_0000483 cts_soc_0005411 cdn_loc_0001355 cdn_eco_0001983 cts_for_0002054 cdn_loc_0002313 ctc_tec_0000654 ctc_mnf_0000801 cts_ent_0002614 ctc_eco_0001180 cdn_soc_0000806 cts_esy_0000355 ctc_ser_0000727 ctc_ser_0000096 cts_for_0001206 ctc_ser_0000272 cts_art_0000114 cts_for_0001293 cts_for_0000336 cts_art_0001137 ctc_fin_0001599 cts_eco_0003969 cts_for_0001589 cdn_chi_0001729 cdn_eco_0001862 cdn_edu_0001042 cts_int_0000064 cts_chi_0002034 ctc_mnf_0000274 ctc_cgo_0000678 cts_art_0000727 ctc_ser_0000032 ctc_ser_0000592 ctc_tec_0000668 ctc_ser_0000186 ctc_eco_0000299 cts_art_0000402 cdn_loc_0001269 ctc_foc_0002331 cdn_chi_0000007 ctc_ser_0000328 ctc_ser_0000271 cte_foc_0002583 cts_pol_0003313 cts_pol_0003261 ctc_cgo_0000559 ctc_ser_0000831 ctc_chi_0000922 ctc_chi_0000119 ctc_ser_0000121 cts_eco_0003399 cts_for_0001570 cts_art_0002068 ctc_tec_0001289 cdn_chi_0002173 ctc_ser_0001165 ctc_ser_0001062 ctc_ser_0001058 ctc_ser_0000215 ctc_chi_0000092
022,ctc_foc_0001687 ctc_dep_0001593 cte_foc_0000854 cdn_foc_0001293 ctc_dep_0000237 cts_foc_0000252 ctc_foc_0000709 cdn_soc_0001383 ctc_esy_0000057 cdn_foc_0006425 cdn_soc_0001068 cdn_foc_0000844 cts_pol_0000134 cdn_foc_0001758 cdn_soc_0001355 cts_eco_0000713 cdn_eco_0000803 cdn_eco_0000802 cdn_soc_0000836 cts_foc_0000992 ctc_mnf_0002393 cdn_for_0000127 ctc_esy_0000044 cts_eco_0000661 ctc_foc_0000538 cdn_eco_0001178 cdn_soc_0001196 ctc_dep_0000149 cts_eco_0003092 cdn_soc_0000866 cts_foc_0000794 cdn_eco_0001180 cts_for_0000058 cdn_eco_0003174 cdn_eco_0002060 ctc_dep_0000432 ctc_foc_0000860 cdn_soc_0001158 ctc_foc_0000564 cdn_foc_0001906 cts_pol_0000083 cts_eco_0001358 cdn_soc_0001801 cdn_soc_0000824 cdn_eco_0001600 ctc_foc_0003560 cdn_foc_0007913 ctc_foc_0000961 cts_pol_0000428 cts_eco_0000767 cdn_soc_0003182 cdn_soc_0001139 cts_eco_0001400 cdn_eco_0000725 ctc_foc_0000079 ctc_foc_0000214 cts_eco_0002250 ctc_foc_0000073 cdn_eco_0002358 cts_for_0000406 cdn_soc_0000992 cdn_foc_0005119 ctc_dep_0000148 ctc_dep_0001219 cdn_eco_0001289 cts_eco_0001294 ctc_chi_0000998 cts_foc_0005006 ctc_foc_0001013 ctc_foc_0000567 ctc_foc_0000624 ctc_foc_0001071 cts_foc_0004652 cdn_eco_0003796 ctc_foc_0001004 ctc_foc_0000153 cdn_foc_0001495 ctc_foc_0001357 cdn_foc_0006432 cdn_eco_0001924 ctc_dep_0001299 ctc_dep_0000350 cte_foc_0000476 cdn_eco_0000141 cts_eco_0002694 ctc_tec_0001602 cts_eco_0003860 ctc_foc_0000589 ctc_foc_0000114 cdn_eco_0000964 cdn_eco_0000892 cts_foc_0003970 cdn_foc_0006494 ctc_foc_0001053 cdn_soc_0001117 cdn_eco_0003776 cte_esy_0000045 ctc_fin_0001138 ctc_foc_0000494 cte_foc_0002239
023,cte_foc_0002963 cdn_spo_0000979 ctc_dep_0001128 cts_ent_0002376 ctc_dep_0001126 cts_eco_0003677 ctc_dep_0001127 cte_foc_0002955 ctc_eco_0001211 cdn_foc_0002588 cts_soc_0001124 cdn_spo_0000976 cts_for_0001671 ctc_ser_0000690 ctc_mnf_0002033 ctc_cgo_0001167 cdn_spo_0000826 ctc_tec_0000205 cdn_spo_0000981 ctc_dep_0000089 ctc_ser_0001106 ctc_ser_0000272 ctc_ser_0001105 cdn_spo_0000974 cte_foc_0001711 ctc_mnf_0001933 cdn_spo_0000980 ctc_tec_0001718 cts_ent_0002916 cts_for_0001628 cdn_soc_0003877 cdn_spo_0000137 cts_ent_0001831 cdn_spo_0001000 ctc_eco_0001418 ctc_esy_0000231 cdn_soc_0001055 ctc_sto_0001677 ctc_mnf_0001390 cts_eco_0003603 ctc_sto_0002946 ctc_eco_0000260 ctc_ser_0000551 cdn_spo_0001429 cts_int_0002787 cdn_foc_0005595 cdn_eco_0003328 cts_eco_0004410 cts_for_0001859 cts_eco_0003286 ctc_sto_0004592 cts_ent_0002533 ctc_sto_0001601 cdn_eco_0000941 ctc_sto_0001453 cdn_ent_0000682 cts_ent_0002893 ctc_tec_0000064 cts_ent_0003596 cdn_ent_0001200 cts_eco_0000119 cdn_spo_0000136 cts_eco_0001035 cts_eco_0001678 cts_eco_0003575 cdn_foc_0008362 ctc_sto_0001157 cdn_spo_0000963 cdn_ent_0000650 ctc_foc_0001610 cdn_eco_0000995 ctc_eco_0001068 ctc_tec_0001272 ctc_mnf_0001658 ctc_esy_0000235 cts_eco_0001510 cdn_spo_0001272 cdn_foc_0001495 ctc_tec_0001181 cdn_eco_0000990 ctc_eco_0000574 cts_eco_0000257 cts_eco_0004077 cts_eco_0002576 cts_eco_0002830 cts_eco_0003504 cdn_foc_0008373 cdn_eco_0002021 ctc_sto_0002171 ctc_mnf_0001085 cts_eco_0004124 cts_int_0002924 cdn_foc_0006885 ctc_dep_0000043 ctc_foc_0003632 cdn_eco_0001081 cdn_eco_0002617 cts_eco_0003505 cts_eco_0003854 cts_eco_0002816
024,cts_soc_0004283 cts_soc_0004251 cts_soc_0004350 cts_for_0001441 cte_foc_0002721 cts_for_0001851 cte_foc_0002716 cdn_soc_0003683 cts_soc_0004282 cts_soc_0004349 cts_for_0001436 cts_soc_0004201 cdn_soc_0003618 cdn_soc_0003638 cts_for_0001435 cts_soc_0004250 cdn_soc_0005145 cdn_foc_0004355 cts_for_0001529 cts_for_0001513 cts_for_0001478 cdn_foc_0003626 cdn_soc_0003631 cts_soc_0004303 cdn_foc_0004373 cts_for_0001479 cte_esy_0000185 cts_for_0001527 cdn_soc_0000948 cts_chi_0001088 ctc_esy_0000066 cts_for_0001618 cdn_loc_0001350 cdn_loc_0002288 cdn_foc_0002002 cdn_chi_0001939 cdn_loc_0001005 cdn_loc_0001013 cts_foc_0002494 cte_foc_0003675 cdn_soc_0003687 cdn_soc_0001745 ctc_dep_0000519 cts_for_0001850 cdn_soc_0005038 cts_soc_0003522 cts_eco_0001665 cts_soc_0006015 cdn_for_0000326 cts_for_0000863 cdn_loc_0001980 cts_soc_0000475 cts_foc_0002433 cdn_loc_0001751 cte_foc_0002131 cdn_foc_0000161 cts_soc_0003733 cdn_loc_0000510 cdn_loc_0001540 cts_pol_0000794 cts_foc_0005639 cdn_loc_0000523 cte_foc_0003676 cts_pol_0001082 cts_foc_0002919 cdn_soc_0002663 cts_pol_0001342 ctc_dep_0000421 cts_foc_0001933 cdn_soc_0002682 cdn_soc_0002786 cdn_foc_0007904 cdn_chi_0000910 cts_chi_0001025 cts_chi_0001016 ctc_esy_0000017 cts_for_0001968 cdn_loc_0001505 cdn_soc_0000402 cts_for_0001630 cdn_soc_0002769 cdn_loc_0001302 cdn_loc_0002114 cdn_soc_0001650 cdn_eco_0001352 cdn_soc_0002890 cdn_soc_0002463 cts_pol_0003173 cdn_loc_0000633 ctc_dep_0000697 cdn_loc_0001248 cdn_soc_0003177 cts_for_0000890 cdn_edu_0001263 ctc_dep_0000007 cdn_loc_0001680 cdn_soc_0004463 cts_chi_0000941 cdn_soc_0002947 ctc_dep_0001077
025,cdn_eco_0001201 cdn_eco_0003653 cts_foc_0005006 ctc_foc_0003257 ctc_foc_0002315 cdn_eco_0003717 cts_eco_0001645 cts_foc_0005005 cdn_eco_0003163 cts_foc_0003666 cts_eco_0003127 cts_foc_0004117 cdn_eco_0003686 ctc_foc_0001334 cdn_foc_0005119 cdn_eco_0003776 cts_eco_0003860 cts_foc_0004122 cts_eco_0002928 cdn_foc_0007931 cts_eco_0003093 cts_foc_0004121 ctc_foc_0003236 ctc_esy_0000201 cts_eco_0003802 cts_eco_0003825 cts_eco_0003778 cdn_foc_0007936 ctc_foc_0001013 ctc_esy_0000233 ctc_esy_0000057 ctc_dep_0000677 ctc_foc_0001553 ctc_foc_0003252 ctc_dep_0000676 ctc_foc_0003638 cdn_eco_0003764 ctc_dep_0000507 ctc_foc_0003210 cdn_foc_0007932 ctc_dep_0000863 cdn_eco_0003736 cts_eco_0003022 cts_eco_0003848 ctc_foc_0003253 cdn_for_0000461 ctc_foc_0001004 ctc_foc_0002622 ctc_foc_0002614 ctc_foc_0002413 ctc_foc_0000620 cts_eco_0003203 ctc_esy_0000190 ctc_dep_0001397 ctc_foc_0003154 ctc_foc_0001948 ctc_foc_0001049 ctc_foc_0002674 cts_foc_0004120 ctc_foc_0001014 ctc_fin_0000825 cdn_foc_0008160 ctc_foc_0001064 cts_eco_0003396 ctc_dep_0001299 cdn_foc_0008298 cdn_eco_0003531 cdn_eco_0002578 cts_foc_0004652 cts_eco_0001307 cdn_foc_0007940 cdn_foc_0008144 ctc_foc_0000160 cts_foc_0004625 ctc_dep_0001376 cts_foc_0004118 cts_eco_0003578 cts_eco_0003861 cdn_foc_0004860 cts_for_0000598 ctc_dep_0000215 cdn_eco_0003174 cdn_foc_0007939 cdn_eco_0000104 ctc_foc_0003169 ctc_foc_0003142 ctc_foc_0003263 cts_eco_0003869 ctc_foc_0003669 cdn_eco_0003084 ctc_tec_0001602 ctc_foc_0003313 ctc_dep_0000965 cdn_eco_0000892 cdn_foc_0006425 ctc_fin_0002195 ctc_foc_0002834 cdn_foc_0007941 cts_eco_0003693 ctc_foc_0000548
026,cts_soc_0006096 cts_soc_0005905 cts_for_0000818 cts_for_0001482 cdn_soc_0003713 ctc_fin_0002077 cts_foc_0004640 cts_soc_0000345 cdn_soc_0000050 cts_soc_0003061 cdn_soc_0000044 cts_soc_0000938 ctc_mnf_0001580 cdn_eco_0000628 cts_for_0000817 cts_soc_0001491 cdn_soc_0002395 cts_soc_0006188 cdn_soc_0002256 ctc_fin_0000696 cts_soc_0004430 cts_soc_0004214 ctc_fin_0002085 cdn_eco_0002756 cdn_soc_0003585 cts_soc_0000373 cts_soc_0002268 cdn_foc_0008452 cts_soc_0001582 cdn_soc_0002049 cts_foc_0005422 ctc_fin_0001801 cdn_soc_0004234 cdn_soc_0000710 cts_soc_0001023 cts_soc_0004212 cts_foc_0005443 cdn_soc_0003187 cts_soc_0003804 cdn_eco_0001873 cdn_foc_0003512 cts_soc_0005847 cdn_soc_0002037 ctc_mnf_0001581 cts_soc_0004537 cdn_soc_0003570 ctc_mnf_0001022 cte_foc_0000241 cdn_soc_0004093 cdn_soc_0000777 cts_foc_0000662 ctc_fin_0002076 cdn_foc_0003990 cdn_soc_0001756 cdn_foc_0002251 cts_soc_0003832 ctc_mnf_0001765 cts_for_0002134 cts_soc_0000312 cdn_soc_0002230 cts_for_0001074 cts_soc_0002433 cdn_foc_0006436 cts_soc_0000901 cdn_soc_0004392 cts_soc_0004130 cte_foc_0002123 cts_soc_0004741 cdn_soc_0002031 cts_soc_0004051 cts_soc_0003844 cts_eco_0004280 cts_soc_0003877 cts_soc_0002796 cts_foc_0004337 cts_soc_0002624 ctc_mnf_0000742 cts_soc_0002730 ctc_ser_0000375 cts_foc_0002693 cts_soc_0001814 cts_soc_0005856 cdn_soc_0003479 cts_soc_0003163 cdn_eco_0001106 cts_soc_0003149 cts_soc_0004540 cdn_soc_0002366 cts_soc_0006237 cdn_soc_0003569 cts_soc_0004202 cts_soc_0005286 cts_chi_0000714 cts_soc_0006223 cts_soc_0006246 ctc_foc_0003205 cte_foc_0000819 cdn_loc_0001388 cts_foc_0000573 cdn_soc_0002558
